{"content_sha256":"5843a969a050f19e897b0d0f8dc2c173d4fedb759bcc7b04ba142c8d9ffebaa2","dataset_content_sha256":"555a821f986614f0a2f2dab455faacc14b86dc96d60b224694592c9299545a14","dataset_record_count":17437,"final_holdout_count":3487,"manifest_kind":"tier_a_human_audit_queue","minimum_sample_size":3000,"raw_text_in_manifest":false,"raw_text_in_queue":true,"record_count":3487,"schema_version":1,"seed":20260813,"selection_algorithm":"final_holdout_plus_stratified_round_robin_sha256_v1","split_counts":{"final-holdout":3487},"stratum_counts":{"reading-03-09/candidates-02-06/local-correct":13,"reading-03-09/candidates-07-16/local-correct":28,"reading-03-09/candidates-07-16/local-wrong":4,"reading-03-09/candidates-17-32/local-correct":2954,"reading-03-09/candidates-17-32/local-wrong":441,"reading-10-30/candidates-17-32/local-correct":47}}
